{
  "schema_version": "1.0",
  "contract_id": "cold-truth.strategist",
  "contract_version": "1.0.0-c1-fixture",
  "run_id": "phase-c1-real-codex-fixture",
  "case_id": "glass-harbor-fixture",
  "stage": "strategist_fixture",
  "attempt": 1,
  "idempotency_key": "0000000000000000000000000000000000000000000000000000000000000000",
  "status": "success",
  "started_at": "2026-07-11T00:00:00Z",
  "completed_at": "2026-07-11T00:00:00Z",
  "inputs": [
    {
      "name": "batch_size",
      "type": "integer",
      "kind": "value",
      "value": 1,
      "sha256": "6b86b273ff34fce19d6b804eff5a3f5747ada4eaa22f1d49c01e52ddb7875b4b"
    },
    {
      "name": "candidate_queue",
      "type": "backlog_or_queue",
      "kind": "value",
      "value": {
        "fixture": true,
        "case_id": "glass-harbor-fixture",
        "case_name": "Glass Harbor Fixture",
        "synthetic_viability": "Standard long-form viable",
        "score_total": 30,
        "score_breakdown": {
          "long_form_source_depth": 5,
          "clear_chronological_narrative": 4,
          "legal_and_misinformation_risk": 5
        },
        "risk_level": "synthetic-none",
        "recommended_disposition": "select",
        "claim_ids": [
          "SYN-C1-01",
          "SYN-C1-02",
          "SYN-C1-03"
        ]
      },
      "sha256": "6fc633b0dfb7731c467caf185310f9c4c15af4adc338a22bc2d22264d5431979"
    },
    {
      "name": "content_standard",
      "type": "policy_document",
      "kind": "value",
      "value": "# Phase C1 Synthetic Standard\n\nUse only the supplied fictional JSON. Preserve its case ID, claim IDs, viability, score, risk, and disposition exactly. Return a structured handoff and perform no other work.\n",
      "sha256": "4c5de6c241420b6e9031a8aa8d622229b46e8c1208c0d9548b5da0b00f1411e6"
    }
  ],
  "outputs": [],
  "result": {
    "candidate_id": "glass-harbor-fixture",
    "viability": "Standard long-form viable",
    "score_total": 30,
    "score_breakdown": {
      "long_form_source_depth": 5,
      "clear_chronological_narrative": 4,
      "legal_and_misinformation_risk": 5
    },
    "risk_level": "synthetic-none",
    "artifact_hashes": {},
    "recommended_disposition": "select",
    "claim_ids": [
      "SYN-C1-01",
      "SYN-C1-02",
      "SYN-C1-03"
    ]
  },
  "decisions": [
    {
      "rule": "fixture_input_only",
      "result": "pass"
    }
  ],
  "warnings": [],
  "errors": [],
  "retryable": false,
  "tool_calls": [],
  "runtime": {
    "provider": "codex-exec",
    "runtime": "controlled-real-fixture",
    "model": "not-reported",
    "version": "not-reported"
  },
  "publishing_enabled": false
}
